

================================================================
== Vitis HLS Report for 'ipv4_lshiftWordByOctet_512_2_s'
================================================================
* Date:           Sat Mar 18 14:34:30 2023

* Version:        2021.2 (Build 3367213 on Tue Oct 19 02:47:39 MDT 2021)
* Project:        ipv4_prj
* Solution:       solution1 (Vivado IP Flow Target)
* Product family: virtexuplus
* Target device:  xcu280-fsvh2892-2L-e


================================================================
== Performance Estimates
================================================================
+ Timing: 
    * Summary: 
    +--------+---------+----------+------------+
    |  Clock |  Target | Estimated| Uncertainty|
    +--------+---------+----------+------------+
    |ap_clk  |  3.20 ns|  2.399 ns|     0.86 ns|
    +--------+---------+----------+------------+

+ Latency: 
    * Summary: 
    +---------+---------+----------+----------+-----+-----+---------+
    |  Latency (cycles) |  Latency (absolute) |  Interval | Pipeline|
    |   min   |   max   |    min   |    max   | min | max |   Type  |
    +---------+---------+----------+----------+-----+-----+---------+
    |        1|        1|  3.200 ns|  3.200 ns|    1|    1|      yes|
    +---------+---------+----------+----------+-----+-----+---------+

    + Detail: 
        * Instance: 
        N/A

        * Loop: 
        N/A

============================================================
+ Verbose Summary: Synthesis Manager
============================================================
InlineROM: 1
ExposeGlobal: 0
============================================================
+ Verbose Summary: CDFG Model
============================================================
IsTopModel: 0
ResetActiveHigh: 1
IsCombinational: 2
IsDatapathOnly: 0
HasWiredReturn: 1
HasMFsm: 2
HasVarLatency: 0
IsPipeline: 1
IsRtlPipelined: 1
IsInstanceOverlapped: 0
IsDontTouch: 0
HasImplIP: 0
IsGatedGlobalClock: 0

+ Individual pipeline summary: 
  * Pipeline-0: initiation interval (II) = 1, depth = 2


============================================================
+ Verbose Summary: Schedule
============================================================
* Number of FSM states : 2
* Pipeline : 1
  Pipeline-0 : II = 1, D = 2, States = { 1 2 }
* Dataflow Pipeline: 0

* FSM state transitions: 
1 --> 2 
2 --> 

* FSM state operations: 

State 1 <SV = 0> <Delay = 2.39>
ST_1 : Operation 3 [1/1] (0.00ns)   --->   "%specinterface_ln0 = specinterface void @_ssdm_op_SpecInterface, i1024 %s_axis_tx_data_internal, void @empty_3, i32 0, i32 0, void @empty_1, i32 0, i32 0, void @empty_1, void @empty_1, void @empty_1, i32 0, i32 0, i32 0, i32 0, void @empty_1, void @empty_1"   --->   Operation 3 'specinterface' 'specinterface_ln0' <Predicate = true> <Delay = 0.00>
ST_1 : Operation 4 [1/1] (0.00ns)   --->   "%specinterface_ln0 = specinterface void @_ssdm_op_SpecInterface, i1024 %s_axis_tx_data_internal, void @empty_3, i32 0, i32 0, void @empty_1, i32 0, i32 0, void @empty_1, void @empty_1, void @empty_1, i32 0, i32 0, i32 0, i32 0, void @empty_1, void @empty_1"   --->   Operation 4 'specinterface' 'specinterface_ln0' <Predicate = true> <Delay = 0.00>
ST_1 : Operation 5 [1/1] (0.00ns)   --->   "%specinterface_ln0 = specinterface void @_ssdm_op_SpecInterface, i1024 %s_axis_tx_data_internal, void @empty_3, i32 0, i32 0, void @empty_1, i32 0, i32 0, void @empty_1, void @empty_1, void @empty_1, i32 0, i32 0, i32 0, i32 0, void @empty_1, void @empty_1"   --->   Operation 5 'specinterface' 'specinterface_ln0' <Predicate = true> <Delay = 0.00>
ST_1 : Operation 6 [1/1] (0.00ns)   --->   "%specinterface_ln0 = specinterface void @_ssdm_op_SpecInterface, i1024 %tx_shift2ipv4Fifo, void @empty_3, i32 0, i32 0, void @empty_1, i32 0, i32 0, void @empty_1, void @empty_1, void @empty_1, i32 0, i32 0, i32 0, i32 0, void @empty_1, void @empty_1"   --->   Operation 6 'specinterface' 'specinterface_ln0' <Predicate = true> <Delay = 0.00>
ST_1 : Operation 7 [1/1] (0.00ns)   --->   "%specinterface_ln0 = specinterface void @_ssdm_op_SpecInterface, i1024 %tx_shift2ipv4Fifo, void @empty_3, i32 0, i32 0, void @empty_1, i32 0, i32 0, void @empty_1, void @empty_1, void @empty_1, i32 0, i32 0, i32 0, i32 0, void @empty_1, void @empty_1"   --->   Operation 7 'specinterface' 'specinterface_ln0' <Predicate = true> <Delay = 0.00>
ST_1 : Operation 8 [1/1] (0.00ns)   --->   "%specinterface_ln0 = specinterface void @_ssdm_op_SpecInterface, i1024 %tx_shift2ipv4Fifo, void @empty_3, i32 0, i32 0, void @empty_1, i32 0, i32 0, void @empty_1, void @empty_1, void @empty_1, i32 0, i32 0, i32 0, i32 0, void @empty_1, void @empty_1"   --->   Operation 8 'specinterface' 'specinterface_ln0' <Predicate = true> <Delay = 0.00>
ST_1 : Operation 9 [1/1] (0.00ns)   --->   "%specinterface_ln0 = specinterface void @_ssdm_op_SpecInterface, i1024 %tx_shift2ipv4Fifo, void @empty_3, i32 0, i32 0, void @empty_1, i32 0, i32 0, void @empty_1, void @empty_1, void @empty_1, i32 0, i32 0, i32 0, i32 0, void @empty_1, void @empty_1"   --->   Operation 9 'specinterface' 'specinterface_ln0' <Predicate = true> <Delay = 0.00>
ST_1 : Operation 10 [1/1] (0.00ns)   --->   "%specinterface_ln0 = specinterface void @_ssdm_op_SpecInterface, i1024 %s_axis_tx_data_internal, void @empty_3, i32 0, i32 0, void @empty_1, i32 0, i32 0, void @empty_1, void @empty_1, void @empty_1, i32 0, i32 0, i32 0, i32 0, void @empty_1, void @empty_1"   --->   Operation 10 'specinterface' 'specinterface_ln0' <Predicate = true> <Delay = 0.00>
ST_1 : Operation 11 [1/1] (0.00ns)   --->   "%specpipeline_ln1233 = specpipeline void @_ssdm_op_SpecPipeline, i32 1, i32 0, i32 0, i32 0, void @empty_1" [/home/yangz0e/Desktop/Vitis_with_100Gbps_TCP-IP_top_k/fpga-network-stack/hls/ipv4/../axi_utils.hpp:1233]   --->   Operation 11 'specpipeline' 'specpipeline_ln1233' <Predicate = true> <Delay = 0.00>
ST_1 : Operation 12 [1/1] (0.00ns)   --->   "%ls_writeRemainder_load = load i1 %ls_writeRemainder" [/home/yangz0e/Desktop/Vitis_with_100Gbps_TCP-IP_top_k/fpga-network-stack/hls/ipv4/../axi_utils.hpp:1247]   --->   Operation 12 'load' 'ls_writeRemainder_load' <Predicate = true> <Delay = 0.00>
ST_1 : Operation 13 [1/1] (0.00ns)   --->   "%p_Val2_s = load i512 %prevWord_data_V"   --->   Operation 13 'load' 'p_Val2_s' <Predicate = true> <Delay = 0.00>
ST_1 : Operation 14 [1/1] (0.00ns)   --->   "%p_Val2_1 = load i64 %prevWord_keep_V"   --->   Operation 14 'load' 'p_Val2_1' <Predicate = true> <Delay = 0.00>
ST_1 : Operation 15 [1/1] (0.00ns)   --->   "%br_ln1247 = br i1 %ls_writeRemainder_load, void, void" [/home/yangz0e/Desktop/Vitis_with_100Gbps_TCP-IP_top_k/fpga-network-stack/hls/ipv4/../axi_utils.hpp:1247]   --->   Operation 15 'br' 'br_ln1247' <Predicate = true> <Delay = 0.00>
ST_1 : Operation 16 [1/1] (0.00ns)   --->   "%tmp_i = nbreadreq i1 @_ssdm_op_NbReadReq.ap_fifo.i1024P0A, i1024 %s_axis_tx_data_internal, i32 1" [/tools/Xilinx/Vitis_HLS/2021.2/common/technology/autopilot/hls_stream_39.h:135]   --->   Operation 16 'nbreadreq' 'tmp_i' <Predicate = (!ls_writeRemainder_load)> <Delay = 0.00> <CoreInst = "FIFO_SRL">   --->   Core 81 'FIFO_SRL' <Latency = 0> <II = 1> <Delay = 1.33> <Storage> <Opcode : 'read' 'write' 'nbread' 'nbwrite'> <Ports = 0> <Width = 1024> <Depth = 2> <FIFO>
ST_1 : Operation 17 [1/1] (0.00ns)   --->   "%br_ln1258 = br i1 %tmp_i, void %._crit_edge1.i, void %_ifconv" [/home/yangz0e/Desktop/Vitis_with_100Gbps_TCP-IP_top_k/fpga-network-stack/hls/ipv4/../axi_utils.hpp:1258]   --->   Operation 17 'br' 'br_ln1258' <Predicate = (!ls_writeRemainder_load)> <Delay = 0.00>
ST_1 : Operation 18 [1/1] (1.16ns)   --->   "%s_axis_tx_data_internal_read = read i1024 @_ssdm_op_Read.ap_fifo.volatile.i1024P0A, i1024 %s_axis_tx_data_internal" [/tools/Xilinx/Vitis_HLS/2021.2/common/technology/autopilot/hls_stream_39.h:144]   --->   Operation 18 'read' 's_axis_tx_data_internal_read' <Predicate = (!ls_writeRemainder_load & tmp_i)> <Delay = 1.16> <CoreInst = "FIFO_SRL">   --->   Core 81 'FIFO_SRL' <Latency = 0> <II = 1> <Delay = 1.33> <Storage> <Opcode : 'read' 'write' 'nbread' 'nbwrite'> <Ports = 0> <Width = 1024> <Depth = 2> <FIFO>
ST_1 : Operation 19 [1/1] (0.00ns)   --->   "%currWord_data_V = trunc i1024 %s_axis_tx_data_internal_read" [/tools/Xilinx/Vitis_HLS/2021.2/common/technology/autopilot/hls_stream_39.h:144]   --->   Operation 19 'trunc' 'currWord_data_V' <Predicate = (!ls_writeRemainder_load & tmp_i)> <Delay = 0.00>
ST_1 : Operation 20 [1/1] (0.00ns)   --->   "%currWord_keep_V = partselect i64 @_ssdm_op_PartSelect.i64.i1024.i32.i32, i1024 %s_axis_tx_data_internal_read, i32 512, i32 575" [/tools/Xilinx/Vitis_HLS/2021.2/common/technology/autopilot/hls_stream_39.h:144]   --->   Operation 20 'partselect' 'currWord_keep_V' <Predicate = (!ls_writeRemainder_load & tmp_i)> <Delay = 0.00>
ST_1 : Operation 21 [1/1] (0.00ns)   --->   "%currWord_last_V = bitselect i1 @_ssdm_op_BitSelect.i1.i1024.i32, i1024 %s_axis_tx_data_internal_read, i32 576" [/tools/Xilinx/Vitis_HLS/2021.2/common/technology/autopilot/hls_stream_39.h:144]   --->   Operation 21 'bitselect' 'currWord_last_V' <Predicate = (!ls_writeRemainder_load & tmp_i)> <Delay = 0.00>
ST_1 : Operation 22 [1/1] (0.00ns)   --->   "%trunc_ln674 = trunc i1024 %s_axis_tx_data_internal_read"   --->   Operation 22 'trunc' 'trunc_ln674' <Predicate = (!ls_writeRemainder_load & tmp_i)> <Delay = 0.00>
ST_1 : Operation 23 [1/1] (0.00ns)   --->   "%p_Result_4_i = partselect i44 @_ssdm_op_PartSelect.i44.i1024.i32.i32, i1024 %s_axis_tx_data_internal_read, i32 512, i32 555"   --->   Operation 23 'partselect' 'p_Result_4_i' <Predicate = (!ls_writeRemainder_load & tmp_i)> <Delay = 0.00>
ST_1 : Operation 24 [1/1] (0.00ns)   --->   "%p_Result_5_i = partselect i20 @_ssdm_op_PartSelect.i20.i1024.i32.i32, i1024 %s_axis_tx_data_internal_read, i32 556, i32 575"   --->   Operation 24 'partselect' 'p_Result_5_i' <Predicate = (!ls_writeRemainder_load & tmp_i)> <Delay = 0.00>
ST_1 : Operation 25 [1/1] (0.72ns)   --->   "%sendWord_last_V = icmp_eq  i20 %p_Result_5_i, i20 0"   --->   Operation 25 'icmp' 'sendWord_last_V' <Predicate = (!ls_writeRemainder_load & tmp_i)> <Delay = 0.72> <CoreInst = "Cmp">   --->   Core 9 'Cmp' <Latency = 0> <II = 1> <Delay = 0.72> <FuncUnit> <Opcode : 'icmp'> <InPorts = 2> <OutPorts = 1>
ST_1 : Operation 26 [1/1] (0.00ns)   --->   "%p_Result_8_i = partselect i160 @_ssdm_op_PartSelect.i160.i512.i32.i32, i512 %p_Val2_s, i32 352, i32 511"   --->   Operation 26 'partselect' 'p_Result_8_i' <Predicate = (!ls_writeRemainder_load & tmp_i)> <Delay = 0.00>
ST_1 : Operation 27 [1/1] (0.00ns)   --->   "%p_Result_10_i = partselect i20 @_ssdm_op_PartSelect.i20.i64.i32.i32, i64 %p_Val2_1, i32 44, i32 63"   --->   Operation 27 'partselect' 'p_Result_10_i' <Predicate = (!ls_writeRemainder_load & tmp_i)> <Delay = 0.00>
ST_1 : Operation 28 [1/1] (0.00ns)   --->   "%store_ln1290 = store i512 %currWord_data_V, i512 %prevWord_data_V" [/home/yangz0e/Desktop/Vitis_with_100Gbps_TCP-IP_top_k/fpga-network-stack/hls/ipv4/../axi_utils.hpp:1290]   --->   Operation 28 'store' 'store_ln1290' <Predicate = (!ls_writeRemainder_load & tmp_i)> <Delay = 0.00>
ST_1 : Operation 29 [1/1] (0.00ns)   --->   "%store_ln1290 = store i64 %currWord_keep_V, i64 %prevWord_keep_V" [/home/yangz0e/Desktop/Vitis_with_100Gbps_TCP-IP_top_k/fpga-network-stack/hls/ipv4/../axi_utils.hpp:1290]   --->   Operation 29 'store' 'store_ln1290' <Predicate = (!ls_writeRemainder_load & tmp_i)> <Delay = 0.00>
ST_1 : Operation 30 [1/1] (0.38ns)   --->   "%br_ln1292 = br i1 %currWord_last_V, void %mergeST.i, void" [/home/yangz0e/Desktop/Vitis_with_100Gbps_TCP-IP_top_k/fpga-network-stack/hls/ipv4/../axi_utils.hpp:1292]   --->   Operation 30 'br' 'br_ln1292' <Predicate = (!ls_writeRemainder_load & tmp_i)> <Delay = 0.38>
ST_1 : Operation 31 [1/1] (0.12ns)   --->   "%xor_ln946 = xor i1 %sendWord_last_V, i1 1"   --->   Operation 31 'xor' 'xor_ln946' <Predicate = (!ls_writeRemainder_load & tmp_i & currWord_last_V)> <Delay = 0.12> <CoreInst = "LogicGate">   --->   Core 74 'LogicGate' <Latency = 0> <II = 1> <Delay = 0.12> <FuncUnit> <Opcode : 'and' 'or' 'xor'> <InPorts = 2> <OutPorts = 1>
ST_1 : Operation 32 [1/1] (0.38ns)   --->   "%store_ln1295 = store i1 %xor_ln946, i1 %ls_writeRemainder" [/home/yangz0e/Desktop/Vitis_with_100Gbps_TCP-IP_top_k/fpga-network-stack/hls/ipv4/../axi_utils.hpp:1295]   --->   Operation 32 'store' 'store_ln1295' <Predicate = (!ls_writeRemainder_load & tmp_i & currWord_last_V)> <Delay = 0.38>
ST_1 : Operation 33 [1/1] (0.38ns)   --->   "%br_ln1296 = br void %mergeST.i" [/home/yangz0e/Desktop/Vitis_with_100Gbps_TCP-IP_top_k/fpga-network-stack/hls/ipv4/../axi_utils.hpp:1296]   --->   Operation 33 'br' 'br_ln1296' <Predicate = (!ls_writeRemainder_load & tmp_i & currWord_last_V)> <Delay = 0.38>
ST_1 : Operation 34 [1/1] (0.00ns)   --->   "%br_ln0 = br void %ipv4_lshiftWordByOctet<512, 2>.exit"   --->   Operation 34 'br' 'br_ln0' <Predicate = (!ls_writeRemainder_load)> <Delay = 0.00>
ST_1 : Operation 35 [1/1] (0.00ns)   --->   "%p_Result_i = partselect i160 @_ssdm_op_PartSelect.i160.i512.i32.i32, i512 %p_Val2_s, i32 352, i32 511"   --->   Operation 35 'partselect' 'p_Result_i' <Predicate = (ls_writeRemainder_load)> <Delay = 0.00>
ST_1 : Operation 36 [1/1] (0.00ns)   --->   "%p_Result_i_49 = partselect i20 @_ssdm_op_PartSelect.i20.i64.i32.i32, i64 %p_Val2_1, i32 44, i32 63"   --->   Operation 36 'partselect' 'p_Result_i_49' <Predicate = (ls_writeRemainder_load)> <Delay = 0.00>
ST_1 : Operation 37 [1/1] (0.38ns)   --->   "%store_ln1256 = store i1 0, i1 %ls_writeRemainder" [/home/yangz0e/Desktop/Vitis_with_100Gbps_TCP-IP_top_k/fpga-network-stack/hls/ipv4/../axi_utils.hpp:1256]   --->   Operation 37 'store' 'store_ln1256' <Predicate = (ls_writeRemainder_load)> <Delay = 0.38>

State 2 <SV = 1> <Delay = 1.74>
ST_2 : Operation 38 [1/1] (0.00ns)   --->   "%ls_firstWord_load = load i1 %ls_firstWord" [/home/yangz0e/Desktop/Vitis_with_100Gbps_TCP-IP_top_k/fpga-network-stack/hls/ipv4/../axi_utils.hpp:1269]   --->   Operation 38 'load' 'ls_firstWord_load' <Predicate = (!ls_writeRemainder_load & tmp_i)> <Delay = 0.00>
ST_2 : Operation 39 [1/1] (0.00ns)   --->   "%p_Result_s = bitconcatenate i512 @_ssdm_op_BitConcatenate.i512.i352.i160, i352 %trunc_ln674, i160 0"   --->   Operation 39 'bitconcatenate' 'p_Result_s' <Predicate = (!ls_writeRemainder_load & tmp_i)> <Delay = 0.00>
ST_2 : Operation 40 [1/1] (0.00ns)   --->   "%p_Result_1 = bitconcatenate i64 @_ssdm_op_BitConcatenate.i64.i44.i20, i44 %p_Result_4_i, i20 1048575"   --->   Operation 40 'bitconcatenate' 'p_Result_1' <Predicate = (!ls_writeRemainder_load & tmp_i)> <Delay = 0.00>
ST_2 : Operation 41 [1/1] (0.00ns)   --->   "%p_Result_2 = bitconcatenate i512 @_ssdm_op_BitConcatenate.i512.i352.i160, i352 %trunc_ln674, i160 %p_Result_8_i"   --->   Operation 41 'bitconcatenate' 'p_Result_2' <Predicate = (!ls_writeRemainder_load & tmp_i)> <Delay = 0.00>
ST_2 : Operation 42 [1/1] (0.00ns)   --->   "%p_Result_3 = bitconcatenate i64 @_ssdm_op_BitConcatenate.i64.i44.i20, i44 %p_Result_4_i, i20 %p_Result_10_i"   --->   Operation 42 'bitconcatenate' 'p_Result_3' <Predicate = (!ls_writeRemainder_load & tmp_i)> <Delay = 0.00>
ST_2 : Operation 43 [1/1] (0.57ns)   --->   "%sendWord_data_V_2 = select i1 %ls_firstWord_load, i512 %p_Result_s, i512 %p_Result_2" [/home/yangz0e/Desktop/Vitis_with_100Gbps_TCP-IP_top_k/fpga-network-stack/hls/ipv4/../axi_utils.hpp:1269]   --->   Operation 43 'select' 'sendWord_data_V_2' <Predicate = (!ls_writeRemainder_load & tmp_i)> <Delay = 0.57> <CoreInst = "Sel">   --->   Core 73 'Sel' <Latency = 0> <II = 1> <Delay = 0.41> <FuncUnit> <Opcode : 'select'> <InPorts = 3> <OutPorts = 1>
ST_2 : Operation 44 [1/1] (0.41ns)   --->   "%select_ln1269 = select i1 %ls_firstWord_load, i64 %p_Result_1, i64 %p_Result_3" [/home/yangz0e/Desktop/Vitis_with_100Gbps_TCP-IP_top_k/fpga-network-stack/hls/ipv4/../axi_utils.hpp:1269]   --->   Operation 44 'select' 'select_ln1269' <Predicate = (!ls_writeRemainder_load & tmp_i)> <Delay = 0.41> <CoreInst = "Sel">   --->   Core 73 'Sel' <Latency = 0> <II = 1> <Delay = 0.41> <FuncUnit> <Opcode : 'select'> <InPorts = 3> <OutPorts = 1>
ST_2 : Operation 45 [1/1] (0.00ns)   --->   "%p_s = bitconcatenate i1024 @_ssdm_op_BitConcatenate.i1024.i447.i1.i64.i512, i447 0, i1 %sendWord_last_V, i64 %select_ln1269, i512 %sendWord_data_V_2" [/tools/Xilinx/Vitis_HLS/2021.2/common/technology/autopilot/hls_stream_39.h:173]   --->   Operation 45 'bitconcatenate' 'p_s' <Predicate = (!ls_writeRemainder_load & tmp_i)> <Delay = 0.00>
ST_2 : Operation 46 [1/1] (1.16ns)   --->   "%write_ln173 = write void @_ssdm_op_Write.ap_fifo.volatile.i1024P0A, i1024 %tx_shift2ipv4Fifo, i1024 %p_s" [/tools/Xilinx/Vitis_HLS/2021.2/common/technology/autopilot/hls_stream_39.h:173]   --->   Operation 46 'write' 'write_ln173' <Predicate = (!ls_writeRemainder_load & tmp_i)> <Delay = 1.16> <CoreInst = "FIFO">   --->   Core 78 'FIFO' <Latency = 0> <II = 1> <Delay = 1.26> <Storage> <Opcode : 'read' 'write' 'nbread' 'nbwrite'> <Ports = 0> <Width = 1024> <Depth = 8> <FIFO>
ST_2 : Operation 47 [1/1] (0.00ns)   --->   "%ls_firstWord_new_0_i = phi i1 1, void, i1 0, void %_ifconv"   --->   Operation 47 'phi' 'ls_firstWord_new_0_i' <Predicate = (!ls_writeRemainder_load & tmp_i)> <Delay = 0.00>
ST_2 : Operation 48 [1/1] (0.00ns)   --->   "%store_ln1291 = store i1 %ls_firstWord_new_0_i, i1 %ls_firstWord" [/home/yangz0e/Desktop/Vitis_with_100Gbps_TCP-IP_top_k/fpga-network-stack/hls/ipv4/../axi_utils.hpp:1291]   --->   Operation 48 'store' 'store_ln1291' <Predicate = (!ls_writeRemainder_load & tmp_i)> <Delay = 0.00>
ST_2 : Operation 49 [1/1] (0.00ns)   --->   "%br_ln1298 = br void %._crit_edge1.i" [/home/yangz0e/Desktop/Vitis_with_100Gbps_TCP-IP_top_k/fpga-network-stack/hls/ipv4/../axi_utils.hpp:1298]   --->   Operation 49 'br' 'br_ln1298' <Predicate = (!ls_writeRemainder_load & tmp_i)> <Delay = 0.00>
ST_2 : Operation 50 [1/1] (0.00ns)   --->   "%or_ln = bitconcatenate i577 @_ssdm_op_BitConcatenate.i577.i45.i20.i352.i160, i45 17592186044416, i20 %p_Result_i_49, i352 0, i160 %p_Result_i" [/tools/Xilinx/Vitis_HLS/2021.2/common/technology/autopilot/hls_stream_39.h:173]   --->   Operation 50 'bitconcatenate' 'or_ln' <Predicate = (ls_writeRemainder_load)> <Delay = 0.00>
ST_2 : Operation 51 [1/1] (0.00ns)   --->   "%zext_ln173 = zext i577 %or_ln" [/tools/Xilinx/Vitis_HLS/2021.2/common/technology/autopilot/hls_stream_39.h:173]   --->   Operation 51 'zext' 'zext_ln173' <Predicate = (ls_writeRemainder_load)> <Delay = 0.00>
ST_2 : Operation 52 [1/1] (1.16ns)   --->   "%write_ln173 = write void @_ssdm_op_Write.ap_fifo.volatile.i1024P0A, i1024 %tx_shift2ipv4Fifo, i1024 %zext_ln173" [/tools/Xilinx/Vitis_HLS/2021.2/common/technology/autopilot/hls_stream_39.h:173]   --->   Operation 52 'write' 'write_ln173' <Predicate = (ls_writeRemainder_load)> <Delay = 1.16> <CoreInst = "FIFO">   --->   Core 78 'FIFO' <Latency = 0> <II = 1> <Delay = 1.26> <Storage> <Opcode : 'read' 'write' 'nbread' 'nbwrite'> <Ports = 0> <Width = 1024> <Depth = 8> <FIFO>
ST_2 : Operation 53 [1/1] (0.00ns)   --->   "%br_ln1257 = br void %ipv4_lshiftWordByOctet<512, 2>.exit" [/home/yangz0e/Desktop/Vitis_with_100Gbps_TCP-IP_top_k/fpga-network-stack/hls/ipv4/../axi_utils.hpp:1257]   --->   Operation 53 'br' 'br_ln1257' <Predicate = (ls_writeRemainder_load)> <Delay = 0.00>
ST_2 : Operation 54 [1/1] (0.00ns)   --->   "%ret_ln0 = ret"   --->   Operation 54 'ret' 'ret_ln0' <Predicate = true> <Delay = 0.00>


============================================================
+ Verbose Summary: Timing violations
============================================================
Target clock period: 3.2ns, clock uncertainty: 0.864ns.

 <State 1>: 2.4ns
The critical path consists of the following:
	fifo read operation ('s_axis_tx_data_internal_read', /tools/Xilinx/Vitis_HLS/2021.2/common/technology/autopilot/hls_stream_39.h:144) on port 's_axis_tx_data_internal' (/tools/Xilinx/Vitis_HLS/2021.2/common/technology/autopilot/hls_stream_39.h:144) [24]  (1.17 ns)
	'icmp' operation ('sendWord.last.V') [32]  (0.722 ns)
	'xor' operation ('xor_ln946') [47]  (0.122 ns)
	'store' operation ('store_ln1295', /home/yangz0e/Desktop/Vitis_with_100Gbps_TCP-IP_top_k/fpga-network-stack/hls/ipv4/../axi_utils.hpp:1295) of variable 'xor_ln946' on static variable 'ls_writeRemainder' [48]  (0.387 ns)

 <State 2>: 1.75ns
The critical path consists of the following:
	'load' operation ('ls_firstWord_load', /home/yangz0e/Desktop/Vitis_with_100Gbps_TCP-IP_top_k/fpga-network-stack/hls/ipv4/../axi_utils.hpp:1269) on static variable 'ls_firstWord' [28]  (0 ns)
	'select' operation ('sendWord.data.V', /home/yangz0e/Desktop/Vitis_with_100Gbps_TCP-IP_top_k/fpga-network-stack/hls/ipv4/../axi_utils.hpp:1269) [39]  (0.578 ns)
	fifo write operation ('write_ln173', /tools/Xilinx/Vitis_HLS/2021.2/common/technology/autopilot/hls_stream_39.h:173) on port 'tx_shift2ipv4Fifo' (/tools/Xilinx/Vitis_HLS/2021.2/common/technology/autopilot/hls_stream_39.h:173) [42]  (1.17 ns)


============================================================
+ Verbose Summary: Binding
============================================================
N/A
* FSMD analyzer results:
  - Output states:
 - Input state : 
  - Chain level:
	State 1
	State 2


============================================================
+ Verbose Summary: Datapath Resource usage 
============================================================
N/A
